<?xml version='1.0' encoding='UTF-8'?>

<!--- Put your DTDDoc comment here. -->
<!ELEMENT multimodals (multimodal)*>

<!--- Put your DTDDoc comment here. -->
<!ELEMENT multimodal (cons|signals)*>
<!ATTLIST multimodal
    emotion CDATA #REQUIRED
   
  >

<!--- Put your DTDDoc comment here. -->
<!ELEMENT signals (signal)*>

<!--- Put your DTDDoc comment here. -->
<!ELEMENT signal EMPTY>
<!ATTLIST signal
    name CDATA #REQUIRED
    type CDATA #IMPLIED
    id CDATA #REQUIRED
    repetitivity CDATA #REQUIRED
    min_duration CDATA #REQUIRED
    max_duration CDATA #REQUIRED
    occurence CDATA #REQUIRED
    probability_start CDATA #REQUIRED
    probability_end CDATA #REQUIRED
  >

<!--- Put your DTDDoc comment here. -->
<!ELEMENT cons (con)*>

<!--- Put your DTDDoc comment here. -->
<!ELEMENT con ( (arg*), (equal|morethan|lessthan))>
<!ATTLIST con
    type (minus|simple) #REQUIRED
    range (local|global) "local"
  >

<!--- Put your DTDDoc comment here. -->
<!ELEMENT arg EMPTY>
<!ATTLIST arg
    type (start|stop) #REQUIRED
    id CDATA #REQUIRED
  >

<!--- Put your DTDDoc comment here. -->
<!ELEMENT lessthan EMPTY>
<!ATTLIST lessthan
    value CDATA #REQUIRED
  >

<!--- Put your DTDDoc comment here. -->
<!ELEMENT morethan EMPTY>
<!ATTLIST morethan
    value CDATA #REQUIRED
  >

<!--- Put your DTDDoc comment here. -->
<!ELEMENT equal EMPTY>
<!ATTLIST equal
    value CDATA #REQUIRED
  >
